{"compositions":[{"id":"filterest","keys":[{"fingerprint":"33b87fb9373923c2d9fbf65e4b79a7951181402f797dc339c38e8a310e15dab4","not_after":"2027-01-01T00:00:00Z","not_before":"2026-10-01T00:00:00Z","public_key":"dOeu7AqWaTISbXBmZsjdnXqLhpc1LOG78gOGGJ3rN/g=","revoked":false},{"fingerprint":"554124820e5296b062bcc1f7fdb6870822df081aaa55c08f440a68c24360a447","not_after":"2027-01-01T00:00:00Z","not_before":"2026-10-01T00:00:00Z","public_key":"tVDu2PWH7op/56beNkq786n7xJku04OS/d7LQnWIdds=","revoked":false}],"publisher":"filterest"},{"id":"easelect","keys":[{"fingerprint":"6cf2acd9378a94dca8ed64443def72b6dcea229bfc976fb92f8e90340dfb2673","not_after":"2027-01-01T00:00:00Z","not_before":"2026-10-01T00:00:00Z","public_key":"dj0UvryVBGy3Ve/pOzt7fD8YGcNp9kCk70+7RcZBqvQ=","revoked":false}],"publisher":"easelect"}],"expires_at":"2027-01-01T00:00:00Z","issued_at":"2026-10-07T07:10:00Z","policy_revision":2,"policy_type":"filterest_release_trust","schema_version":1}
